{
    "$schema": "../schemas/ai-artifacts-registry.schema.json",
    "version": "1.0",
    "personas": {
        "definitions": {
            "developer": {
                "name": "Developer",
                "description": "Software engineers"
            }
        }
    },
    "agents": {
        "standalone-agent": {
            "maturity": "stable",
            "personas": [
                "developer"
            ],
            "tags": [
                "standalone"
            ]
        }
    },
    "prompts": {},
    "instructions": {},
    "skills": {}
}