{
    "$schema": "../../../linting/schemas/ai-artifacts-registry.schema.json",
    "version": "1.0",
    "personas": {
        "definitions": {
            "developer": {
                "name": "Developer",
                "description": "Software engineers building applications"
            },
            "devops": {
                "name": "DevOps Engineer",
                "description": "Infrastructure and deployment specialists"
            }
        }
    },
    "agents": {
        "test-agent": {
            "maturity": "stable",
            "personas": [
                "developer"
            ],
            "tags": [
                "test"
            ],
            "requires": {
                "agents": [],
                "prompts": [
                    "test-prompt"
                ],
                "instructions": [
                    "test-instruction"
                ],
                "skills": []
            }
        },
        "dependent-agent": {
            "maturity": "stable",
            "personas": [
                "developer",
                "devops"
            ],
            "tags": [
                "test"
            ],
            "requires": {
                "agents": [
                    "test-agent"
                ],
                "prompts": [],
                "instructions": [],
                "skills": [
                    "test-skill"
                ]
            }
        }
    },
    "prompts": {
        "test-prompt": {
            "maturity": "stable",
            "personas": [
                "developer"
            ],
            "tags": [
                "test"
            ]
        }
    },
    "instructions": {
        "test-instruction": {
            "maturity": "stable",
            "personas": [
                "developer"
            ],
            "tags": [
                "test"
            ]
        }
    },
    "skills": {
        "test-skill": {
            "maturity": "stable",
            "personas": [
                "devops"
            ],
            "tags": [
                "test"
            ]
        }
    }
}