{
    "$schema": "../schemas/ai-artifacts-registry.schema.json",
    "version": "1.0",
    "personas": {
        "definitions": {
            "developer": {
                "name": "Developer",
                "description": "Software engineers"
            }
        }
    },
    "agents": {
        "broken-agent": {
            "maturity": "stable",
            "personas": [
                "developer"
            ],
            "tags": [],
            "requires": {
                "agents": [
                    "nonexistent-agent"
                ],
                "prompts": [
                    "nonexistent-prompt"
                ],
                "instructions": [
                    "nonexistent-instruction"
                ],
                "skills": [
                    "nonexistent-skill"
                ]
            }
        }
    },
    "prompts": {},
    "instructions": {},
    "skills": {}
}