{
    "$schema": "../../../linting/schemas/ai-artifacts-registry.schema.json",
    "version": "1.0",
    "personas": {
        "definitions": {
            "developer": {
                "name": "Developer",
                "description": "Software engineers"
            }
        }
    },
    "agents": {
        "bad-agent": {
            "maturity": "stable",
            "personas": [
                "nonexistent-persona",
                "also-undefined"
            ],
            "tags": [],
            "requires": {
                "agents": [],
                "prompts": [],
                "instructions": [],
                "skills": []
            }
        }
    },
    "prompts": {
        "bad-prompt": {
            "maturity": "stable",
            "personas": [
                "undefined-persona"
            ],
            "tags": []
        }
    },
    "instructions": {},
    "skills": {}
}